{"type":"config","name":"parallel runner efficiency","metricName":"parallel_flow_ns_per_op","metricUnit":"ns/op","bestDirection":"lower"}
{"run":1,"commit":"3705141","metric":796991230,"metrics":{"parallel_flow_b_per_op":301328,"parallel_flow_allocs_per_op":2442},"status":"keep","description":"baseline","timestamp":1774481315,"segment":0}
{"run":2,"commit":"fc435aa","metric":167201083,"metrics":{"parallel_flow_b_per_op":352666,"parallel_flow_allocs_per_op":2658},"status":"keep","description":"execute independent ready nodes concurrently","timestamp":1774467765,"segment":0}
{"run":3,"commit":"14c48f9","metric":129007182,"metrics":{"parallel_flow_b_per_op":341901,"parallel_flow_allocs_per_op":2654},"status":"keep","description":"serialize observer callbacks for parallel execution","timestamp":1774467765,"segment":0}
{"run":4,"commit":"14c48f9","metric":222101774,"metrics":{"parallel_flow_b_per_op":228227,"parallel_flow_allocs_per_op":1458},"status":"discard","description":"precompile template regexes only","timestamp":1774467765,"segment":0}
{"run":5,"commit":"14c48f9","metric":131964369,"metrics":{"parallel_flow_b_per_op":399348,"parallel_flow_allocs_per_op":2665},"status":"discard","description":"reuse a shared http client in request nodes","timestamp":1774467765,"segment":0}
{"run":6,"commit":"948b0aa","metric":57957945,"metrics":{"parallel_flow_b_per_op":385893,"parallel_flow_allocs_per_op":2652},"status":"keep","description":"fast-path singleton ready batches","timestamp":1774467765,"segment":0}
{"run":7,"commit":"2fd3963","metric":57640743,"metrics":{"parallel_flow_b_per_op":327939,"parallel_flow_allocs_per_op":2634},"status":"keep","description":"preserve flow order in ready node scans","timestamp":1774467765,"segment":0}
{"run":8,"commit":"HEADPEND","metric":56074748,"metrics":{"parallel_flow_b_per_op":365472,"parallel_flow_allocs_per_op":2693},"status":"keep","description":"make AllOutputs a read-only snapshot view","timestamp":1774467765,"segment":0}
